	title	content	autors	date	update_date	url	source
201	PF faz busca contra ex-governador do TO por suspeita de fraude em licitação	"A PF (Polícia Federal) cumpre nesta segunda-feira (26) mandados de busca e apreensão contra o ex-governador do Tocantins Mauro Carlesse (Agir) por fraude em licitação.
O que aconteceu
A PF investiga esquema de lavagem de dinheiro, organização criminosa e peculato. Ao todo, são cumpridos 30 mandados de busca e apreensão contra Carlesse e outros alvos, além de medidas cautelares diversas de prisão. Os mandados foram determinados pela 4ª Vara Federal de Palmas, para cumprimento em Palmas, Gurupi e Dianópolis.
Licitação investigada é de uma empresa contratada para prestar serviços de locação de caminhões. Segundo a PF, a contratação foi feita em 2018 pela extinta Secretaria de Infraestrutura, Cidades e Habitação. A empresa também ficaria responsável pelo fornecimento de combustível e manutenção preventiva e corretiva para atender os escritórios da Ageto (Agência Tocantinense de Transportes e Obras).
O UOL tenta contato com Mauro Carlesse. O espaço está aberto para manifestação.
Operação da PF é a 3ª em uma semana no TO
Primeira ação da PF teve como alvo o atual governador do estado. A força-tarefa foi deflagrada na última quarta-feira (21) para investigar desvios de recursos públicos da covid-19 para o fornecimento de cestas básicas. Wanderlei Barbosa (Republicanos) foi um dos alvos da operação.
Wanderlei Barbosa foi vice de ex-governador que renunciou. Eleito vice-governador em 2018, o atual governador assumiu o estado do Tocantins em 2021, quando Mauro Carlesse renunciou ao mandato para não sofrer processo de impeachment na Assembleia Legislativa. Barbosa foi reeleito em 2022.
Segunda operação mirou alta cúpula do Judiciário em Tocantins. A investigação é contra a presidente da Corte estadual Etelvina Maria Sampaio Felipe e a vice-presidente Ângela Maria Ribeiro Prudente, além da desembargadora Angela Issa Haonat e do desembargador João Rigo Guimarães, que preside o Tribunal Regional Eleitoral do Tocantins. Eles são suspeitos de participaram de um esquema de venda de sentenças judiciais."	Caíque Alencar	2024-08-26T12:17:46-03:00		https://noticias.uol.com.br/politica/ultimas-noticias/2024/08/26/pf-cumpre-buscas-ex-governador-tocantins-fraude-licitacao.htm	UOL
202	Vídeo de homem colocando fogo em pasto é de 2020 e foi feito em Mato Grosso	"Posts nas redes sociais enganam ao dizer que um vídeo de um homem colocando fogo em um pasto tem relação com os incêndios atuais no interior de São Paulo.
O vídeo que voltou a circular é, na verdade, de 2020 e foi feito em Mato Grosso.
A checagem foi sugerida ao UOL Confere pelo WhatsApp (11) 97684-6049.
O que diz o post
O vídeo mostra um rapaz, que parece estar em um trator, colocando fogo em um pasto. Acima do vídeo, a publicação diz: ""Esses fascistas do interior de São Paulo estavam pensando o que?? Que iam colocar fogo nos canaviais e que os satélites não iam detectar que foi simultaneamente ao mesmo tempo?""
Alguns post não trazem a menção a São Paulo, mas foram publicados recentemente, no contexto dos incêndios que atingem o país, principalmente São Paulo.
Todos os posts trazem sobreposto ao vídeo as seguintes frases: ""O satélite viu tudo ao mesmo tempo! Nada de combustão espontânea!!"" e ""O agro é fogo. Queimadas criminosas se alastram pelo país!"".
Por que é falso
Vídeo é de 2020. Por meio de pesquisa reversa (aqui) é possível encontrar o mesmo vídeo no Facebook com data de setembro de 2020 (aqui).
Imprensa de Mato Grosso registra o caso. Ao menos duas reportagens que mostram as mesmas imagens foram veiculadas em setembro de 2020 (aqui e aqui). Na época, a Secretaria Estadual de Meio Ambiente (Sema) de MT informou que investigava o caso.
Homem fala ""Mato Grosso"". Durante o vídeo, é possível escutar o rapaz dizer: ""Aí, sim, Mato Grosso véio (sic)"".
Interior de São Paulo tem onda de incêndios. De fato, o estado registra uma série de queimadas que já provocaram mortes, bloqueio total ou parcial de rodovias e restrição de atividades em aeroportos. O governo paulista decretou, na última sexta-feira (23), emergência em alguns municípios e, até o momento, três suspeitos de provocar queimadas foram presos (aqui).
Viralização. Um post no Instagram tinha, até esta segunda-feira (26), 42,6 mil visualizações.
Sugestões de checagens podem ser enviadas para o WhatsApp (11) 97684-6049 ou para o email uolconfere@uol.com.br.
5 dicas para você não cair em fake news"	Thâmara Kaoru	2024-08-26T18:11:16-03:00		https://noticias.uol.com.br/confere/ultimas-noticias/2024/08/26/video-de-homem-colocando-fogo-em-pasto-e-de-2020-e-foi-feito-no-mato-grosso.htm	UOL
203	Vídeo distorce posts de bolsonaristas para associá-los a queimadas	"Um post que circula nas redes sociais usa recortes de vídeos e publicações de bolsonaristas sobre uma manifestação no dia 7 de setembro deste ano para sugerir que eles teriam relação com as queimadas que acontecem em vários estados.
O post enganoso omite informações como data e contexto das publicações.
O UOL Confere considera distorcido conteúdos que usam informações verdadeiras em contexto diferente do original, alterando seu significado de modo a enganar e confundir quem os recebe.
A sugestão de checagem foi enviada ao UOL Confere pelo WhatsApp (11) 97684-6049.
O que diz o post
O vídeo faz um compilado de falas e posts de bolsonaristas convocando para um ato a favor do impeachment de Alexandre de Moraes programado para acontecer em setembro e tira de contexto para relacioná-los às queimadas que atingem o Brasil. 
O conteúdo intercala falas doe alguns políticos, como Eduardo Bolsonaro e Nikolas Ferreira, com imagens de incêndios. Em um dos vídeos, o pastor Silas Malafaia fala que ""o Brasil vai pegar fogo"". No final, o narrador do vídeo pergunta: ""Foi coincidência?""
Por que é distorcido
As publicações das pessoas que aparecem no vídeo não têm relação com as queimadas. Todos os posts são convocatórias para uma manifestação programada para o dia 7 de setembro, na avenida Paulista (aqui), como é possível verificar nos perfis de Silas Malafaia (veja aqui) e Eduardo Bolsonaro (aqui).
Post desinformativo omite data. No caso de Malafaia, o post enganoso corta e omite a data presente na imagem publicada por ele, que indica se tratar da manifestação. Veja o post original abaixo:
Queimadas em São Paulo. Desde ontem (25), ao menos 46 municípios do estado estão em alerta máximo por causa de focos ativos de incêndio. Um homem preso em flagrante ateando fogo em uma área de mata preservada em Batatais, no interior, disse ter agido em nome do PCC. No sábado (24), em Ribeirão Preto, moradores chegaram a ter que deixar suas casa, cercadas por fogo e tempestade de poeira (leia aqui). Incêndios também foram registrados no Centro-Oeste.
Viralização. No Instagram, um post com o conteúdo enganoso registrava mais de 44 mil reproduções e mais de 4.000 curtidas.
Sugestões de checagens podem ser enviadas para o WhatsApp (11) 97684-6049 ou para o email uolconfere@uol.com.br.
5 dicas para você não cair em fake news"	Isabela Aleixo	2024-08-26T17:54:46-03:00		https://noticias.uol.com.br/confere/ultimas-noticias/2024/08/26/video-distorce-posts-de-bolsonaristas-para-associa-los-a-queimadas.htm	UOL
204	Silvio Santos morreu após complicações da H1N1; vídeo de queda é de 2014	"Não é verdade que o apresentador Silvio Santos morreu por causa de uma queda no programa dele. O vídeo que circula nas redes sociais é de 2014.
Silvio Santos estava afastado dos estúdios de TV desde setembro de 2022. Ele morreu em decorrência de uma broncopneumonia após infecção por H1N1.
O UOL Confere considera distorcido conteúdos que usam informações verdadeiras em contexto diferente do original, alterando seu significado de modo a enganar e confundir quem os recebe.
O que diz o post
Um vídeo que mostra o apresentador Silvio Santos caindo durante um programa é compartilhado com a seguinte legenda sobreposta: ""Vejam so gente Silvio Santos caiu do nada ele há estava passando mal gente. Silvio Santos morreu aos 93 anos gente hoje, vai deixa saudades"". O post sugere que o vídeo é recente.
Por que é distorcido
A queda aconteceu há 10 anos. Em uma busca reversa por um frame do vídeo (confira aqui) foi possível encontrar o fato noticiado em vários sites, assim como registros do mesmo vídeo no Youtube com data de junho de 2014 (veja aqui, aqui e aqui).
O tombo aconteceu durante sorteio da TeleSena. O fato ocorreu em 29 de junho de 2014, como mostram matérias do UOL (aqui e aqui). Silvio Santos não percebeu o desnível do palco e se desequilibrou. Segundo reportagem do UOL, o apresentador pediu à direção do programa que a queda fosse ao ar, já que o programa era gravado. Após o tombo, Silvio riu e continuou apresentando a atração normalmente.
O apresentador estava afastado da televisão desde 2022 (aqui). Desde então, o programa Silvio Santos estava sendo apresentado pela filha dele, Patrícia Abravanel.
Silvio Santos morreu em decorrência de uma broncopneumonia após infecção por influenza H1N1 no dia 17 de agosto de 2024 (leia aqui).
Viralização. No Facebook, um vídeo com o conteúdo enganoso registrava mais de 3.000 curtidas até esta segunda-feira (26).
Este conteúdo também foi checado por Estadão Verifica.
Sugestões de checagens podem ser enviadas para o WhatsApp (11) 97684-6049 ou para o email uolconfere@uol.com.br.
5 dicas para você não cair em fake news"	Isabela Aleixo	2024-08-26T16:50:09-03:00		https://noticias.uol.com.br/confere/ultimas-noticias/2024/08/26/silvio-santos-morte-h1n1-video-de-queda-e-de-2014.htm	UOL
205	Drone militar atinge prédio residencial na Rússia; veja vídeo	"Um drone militar atingiu um prédio residencial em Saratov, na Rússia, nesta segunda-feira (26).
O que aconteceu
As autoridades russas culparam a Ucrânia pelo ataque. Não houve comentários imediatos da Ucrânia. Quatro pessoas ficaram feridas. Segundo a imprensa russa, uma mulher foi internada e está em estado grave.
Um vídeo mostra o momento em que o drone atinge o prédio. A imagem, publicada no Telegram pelo canal de notícias russo SHOT, mostra que o drone explode ao atingir o edifício.
Fotografias mostram que várias janelas foram quebradas, em pelo menos três andares. O prédio de 38 andares fica localizado complexo residencial Volga Sky, e é o mais alto da cidade, com 128 metros.
Rússia e Ucrânia negam ter civis como alvos nos seus ataques. Os dois governos dizem visar destruir infraestruturas essenciais para os esforços de guerra, publicou a Reuters.
Segundo o governo russo, 22 drones ucranianos foram interceptados e abatidos à noite e pela manhã. A maioria dos drones foi abatida no território da região de Saratov.
Rússia lança grande ataque de mísseis e drones contra Ucrânia
Quinze regiões da Ucrânia foram atingidas por um ataque russo ""massivo"" nesta segunda-feira (26), segundo o governo ucraniano. O ataque deixou pelo menos três mortos no oeste e no sul do país. Em uma mensagem publicada no Telegram, o primeiro-ministro ucraniano, Denys Shmygal, disse que as forças russas usaram drones, mísseis hipersônicos e de cruzeiro.
O Ministério da Defesa russo confirmou os ataques em um comunicado divulgado no Telegram. ""As Forças Armadas russas realizaram um ataque massivo com armas de longo alcance e de alta precisão, lançadas do ar e do mar contra importantes infraestruturas de energia, que permitem a operação do complexo militar-industrial da Ucrânia"", diz o texto.
""Todas as metas foram cumpridas"", diz o comunicado. A Rússia tem como alvo locais de produção de energia na região de Lviv, no oeste da Ucrânia, que provocam apagões parciais, disse o governador regional Maksym Kozytsky, no Telegram.
Explosões também atingiram a capital Kiev nesta segunda-feira. Nas ruas, vários habitantes se esconderam em becos cobertos ou se aglomeraram perto de entradas de metrô e túneis subterrâneos que servem como abrigos.
A operadora de energia ucraniana DTEK também anunciou algumas quedas de energia. ""Engenheiros elétricos estão trabalhando para restaurar o serviço"", disse o gabinete do prefeito da capital em seu comunicado.
Com Reuters, AFP e RFI"		2024-08-26T19:01:54-03:00		https://noticias.uol.com.br/internacional/ultimas-noticias/2024/08/26/drone-militar-atinge-predio-residencial-na-russia.htm	UOL
206	Jornalista da Reuters está em estado crítico após ataque na Ucrânia	"Ivan Lyubysh-Kirdey, jornalista da Reuters, está em condição crítica depois de um ataque com míssil no sábado em um hotel na cidade ucraniana de Kramatorsk, de acordo com a agência de notícias.
Lyubysh-Kirdey fazia parte de uma equipe de seis pessoas da Reuters que cobria a guerra na Ucrânia. Eles estavam hospedados no Hotel Sapphire quando ele foi atingido por um míssil. Ryan Evans, um consultor de segurança da agência, foi morto no ataque.
Outro jornalista da Reuters, Daniel Peleschuk, ficou ferido, enquanto os outros três membros da equipe foram localizados, segundo a agência.
""O vídeo-jornalista da Reuters, Ivan Lyubysh-Kirdey, segue em estado crítico. Nosso outro colega, o correspondente na Ucrânia, Daniel Peleschuk, foi tratado e já saiu do hospital?, disse a Reuters em comunicado.
Lyubysh-Kirdey, 40 anos, trabalha para a Reuters desde 2022 e anteriormente trabalhou para a Radio Free Europe/Radio Liberty. Pai de um filho, ele é cidadão ucraniano e recebeu a ordem ao mérito pelo presidente Volodymyr Zelenskiy em 2022 por seus serviços ao jornalismo.
Na segunda-feira, o porta-voz do Kremlin, Dmitry Peskov, não falou diretamente se Moscou havia atacado o Hotel Sapphire em uma teleconferência com repórteres, mas disse que Moscou só ataca infraestruturas militares ou locais ""relacionados de alguma forma com infraestruturas militares""."	Rachel Armstrong	2024-08-26T18:28:43-03:00	2024-08-26T19:08:06-03:00	https://noticias.uol.com.br/ultimas-noticias/reuters/2024/08/26/jornalista-da-reuters-esta-em-estado-critico-apos-ataque-na-ucrania.htm	UOL
207	Presidente da Nicarágua critica postura de Lula sobre Venezuela	"""Você está se rebaixando, Lula"", ""Pobre Petro"". O presidente da Nicarágua, Daniel Ortega, criticou, nesta segunda-feira (26), seus pares brasileiro, Luiz Inácio Lula da Silva, e colombiano, Gustavo Petro, por suas posições sobre a polêmica eleição presidencial na Venezuela.
""A forma como Lula tem se comportado sobre a vitória do presidente legítimo da Venezuela é uma forma vergonhosa, vergonhosa, repetindo os lemas dos ianques, dos europeus, dos governos rebaixados da América Latina"", denunciou Ortega durante uma cúpula virtual de chefes de Estado e governo do ALBA-TCP.
""Você também está se rebaixando, Lula!"", disse Ortega. ""Lula, se você quiser que o povo bolivariano o respeite, respeita a vitória do presidente Nicolás Maduro, e não fique ali, como um rebaixado"", acrescentou Ortega, que também questionou seu homólogo colombiano.
""A Petro, o que posso dizer a Petro? Pobre Petro, pobre Petro, eu vejo Petro competindo com Lula para ver quem vai ser o líder para representar os ianques na América Latina, é assim que vejo Petro, porque o pobre Petro não tem a força que tem o Brasil [...], o gigante da América Latina"", acrescentou Ortega.
Brasil e Colômbia lideram os esforços internacionais para resolver a crise pós-eleitoral na Venezuela, marcada por denúncias de fraude, e sugeriram repetir a votação, uma proposta repudiada tanto pelo chavismo quanto pela oposição.
Lula, aliado histórico do chavismo, disse, em 16 de agosto, durante entrevista à Rádio Gaúcha, que ""a Venezuela vive um regime muito desagradável"", embora não considere que ""seja uma ditadura"", mas sim ""um governo com viés autoritário"".
Maduro foi proclamado vencedor das eleições pelo Conselho Nacional Eleitoral (CNE), com 52% dos votos, embora, quase um mês após a votação, a entidade siga sem publicar a apuração detalhada seção por seção, alegando ter sofrido um ""ciberataque terrorista"".
Por sua vez, a oposição, liderada por María Corina Machado, garante ter provas de que houve fraude e que seu candidato, Edmundo González Urrutia, venceu o pleito.
Após a publicação dos resultados da votação pelo CNE, de viés chavista, houve protestos que deixaram 27 mortos, dois deles militares, além de 200 feridos e cerca de 2.400 detidos, que são tachados por Maduro de ""terroristas"".
O Tribunal Supremo de Justiça (TSJ), acusado de servir ao governo, chancelou na quinta-feira, 22 de agosto, os resultados do CNE, após aceitar um recurso apresentado por Maduro para ""certificar"" as eleições e acusou González Urrutia, alvo de uma investigação penal, de ""desacato""."		2024-08-26T18:04:39-03:00	2024-08-26T19:03:15-03:00	https://noticias.uol.com.br/ultimas-noticias/afp/2024/08/26/presidente-da-nicaragua-critica-postura-de-lula-sobre-venezuela.htm	UOL
208	Avalanche teria combinado código para mulher se despedir da família	"Ex-dirigente do PRTB, Rachel de Carvalho diz que Leonardo Avalanche combinou um ""código"" para que ela se despedisse da família.
Em entrevista à coluna, ela afirmou que essa foi a primeira ameaça de morte que recebeu do político, que preside o partido do candidato à Prefeitura de São Paulo, Pablo Marçal.
""Eu sou tranquilo, mas vai ter um dia que vou te ligar e dizer: vai pegar a sua vara e vai pescar. Quando eu disser isso, pode começar a se despedir da sua família, porque vou te matar"", teria afirmado Avalanche, conforme o relato de Rachel.
Ela registrou as acusações no TSE (Tribunal Superior Eleitoral) em ação que solicita que Avalanche seja afastado do comando do partido, revelou a Folha de S.Paulo.
Rachel também diz ter feito reclamações no Ministério Público Federal, na Polícia Federal e na delegacia da Polícia Civil.
A conversa teria ocorrido no dia 12 de março em um restaurante em São Paulo, na Mooca. Os dois disputavam o comando do partido. Conforme os relatos de Rachel, eles haviam selado um acordo em que Avalanche ocupava a presidência, enquanto Rachel ficava na vice-presidência, indicava o secretário geral e alguns membros do diretório.
Ela diz que o político vinha assediando membros do diretório para renunciar e que, por isso, foi ao restaurante onde ele estava para reclamar.
A ex-dirigente do PRTB relata outra ameaça sofrida pouco tempo depois no dia 16 de março - seu aniversário - também em São Paulo. Segundo ela, Avalanche a chamou para uma nova conversa no escritório do seu advogado.
Rachel diz ter ido acompanhada do marido, mas que não foi recebida por Avalanche, mas apenas por seu advogado. Ainda conforme seu relato, o advogado teria oferecido R$ 2 milhões para que ela se afastasse do partido e ficasse quieta.
E que ele teria dito: ""isso aqui não é um acordo, é uma condição. se você abrir a boca, nunca mais vai olhar no olho de ninguém"".
Ainda conforme o relato da dirigente, um novo episódio ocorreu no dia 19 de março, em Brasília. Rachel e Avalanche teriam voltado a se encontrar no aeroporto da capital.
Ela disse que o presidente do PRT afirmou que ia ""soltar os pitbulls"" e repetiu para ela ""não esquecer da vara de pescar"".
Rachel relata ainda outras ameaças dos advogados do Avalanche para que ela conseguisse a renúncia dos membros que indicou para o diretório.
Questionada pela reportagem do motivo de decidir denunciar e trazer a ameaça a público em meio à campanha eleitoral, Rachel diz que não tem medo. ""Tenho que confiar em algo nesse mundo"", afirmou.
Procurado pela coluna, Avalanche não retornou os contatos."	Raquel Landim	2024-08-26T14:04:00-03:00		https://noticias.uol.com.br/colunas/raquel-landim/2024/08/26/avalanche-teria-combinado-codigo-para-mulher-se-despedir-da-familia.htm	UOL
209	Tabata desafia Pablo Marçal: 'Não foge que vai ser pior!'	"Na política, os acontecimentos mudam tão rapidamente que aqueles que hesitam em fazer alguma coisa são geralmente surpreendidos por alguém fazendo a coisa. Receosos de confrontar sob refletores o vale-tudo adotado por Pablo Marçal, Guilherme Boulos, Ricardo Nunes e José Luiz Datena transformaram a hesitação num processo de valorização do papel de Tabata Amaral na corrida à Prefeitura de São Paulo. 
Beneficiada pela vacilação dos homens, Tabata avança sobre Marçal nas searas jurídica e política. No sábado, seu partido, o PSB, obteve na Justiça Eleitoral liminar que bloqueou os perfis de Marçal nas redes sociais. Nesta segunda-feira, levou à internet, um vídeo no qual rememora o processo judicial que envolve Marçal e gruda o acrônimo do PCC na imagem do rival que se especializou em depreciar biografias alheias com acusações falaciosas.
""Uma pesquisa por seus aliados esbarra sempre nas mesmas letras. P de Pablo, C de coach e C de criminoso"", disse Tabata no vídeo, antes de afirmar que anseia por um novo confronto com Marçal no debate promovido pela TV Gazeta e pelo site MyNews, no próximo domingo. ""Os outros candidatos já disseram que não vão. Vamos ser só eu e você. Vou apresentar as minhas propostas para a cidade, mas também vou desmascarar você mais uma vez. [...] Não foge, que vai ser pior!"", declarou Tabata, em timbre de desafio.
Este será o terceiro debate. No segundo, Boulos, Nunes e Datena ausentaram-se. Fustigado por questionamentos de Tabata, Marçal transformou sua presença numa constrangedora ausência. Disse que responderia às indagações no conforto do Instagram, seu habitat natural. Nesse meio tempo, a fuga dos marmanjos foi punida com um Datafolha que revelou a ascensão meteórica de Marçal, agora tecnicamente empatado com os líderes Boulos e Nunes.
Para driblar o veto judicial às suas redes, Marçal criou perfis alternativos. Só no Instagram, ganhou quase que instantaneamente 2,8 milhões de seguidores. No seu vídeo, Tabata insinuou ter desvendado o truque. ""A gente já identificou como ele ganhou tantos seguidores na conta nova em tão pouco tempo."" Ofereceu o spoiler do que parece ser o esboço de nova ação judicial: ""Não foi graças ao rostinho harmonizado dele"", fustigou.
A dinâmica da campanha não favorece Tabata. No Datafolha, ela aparece em quinto lugar, numericamente atrás de Datena. Mas ainda que não obtenha o triunfo eleitoral, como parece provável, o confronto direto com Marçal já rendeu à candidata um feito político: Tabata sairá da campanha municipal maior do que entrou."	Josias de Souza	2024-08-26T18:20:38-03:00		https://noticias.uol.com.br/colunas/josias-de-souza/2024/08/26/tabata-desafia-pablo-marcal-nao-foge-que-vai-ser-pior.htm	UOL
210	Reinaldo: Há instrumentos para barrar Marçal; leis serão aplicadas ou não?		Reinaldo Azevedo	2024-08-26T14:57:13-03:00		https://noticias.uol.com.br/colunas/reinaldo-azevedo/2024/08/26/reinaldo-ha-instrumentos-para-barrar-marcal-leis-serao-aplicadas-ou-nao.htm	UOL
