	title	content	autors	date	update_date	url	source
129	Ex-assessor de Moraes quer barrar inquéritos abertos 'espontaneamente' por ministros do STF	"A defesa do perito Eduardo Tagliaferro prepara uma ação de institucionalidade que será apresentada ao Supremo Tribunal Federal (STF) nos próximos dias para questionar a abertura de inquéritos de ofício pelos ministros, como ocorreu na investigação sobre o vazamento de mensagens do gabinete de Alexandre de Moraes.
O advogado Eduardo Kuntz considera que essa prerrogativa deveria ser exercida exclusivamente pelo presidente do tribunal.
Segundo o criminalista pretende argumentar na ação, as investigações deveriam ser instauradas pelo ministro-presidente e, na sequência, sorteadas para relatoria entre os membros da corte.
O processo deve se basear no artigo 43 do regimento interno do STF. Esse foi o dispositivo usado para justificar a abertura do inquérito das fake news no Supremo, em 2019. O artigo prevê que ""ocorrendo infração à lei penal na sede ou dependência do tribunal, o presidente instaurará inquérito, se envolver autoridade ou pessoa sujeita à sua jurisdição, ou delegará esta atribuição a outro ministro"".
Para o advogado, o ministro Alexandre de Moraes não poderia ter agido de ofício, ou seja, sem a provocação de órgãos de investigação, como o Ministério Público, ao abrir a investigação sobre o vazamento das mensagens envolvendo seus auxiliares. Na avaliação do criminalista, o inquérito é nulo e deve ser arquivado por vício formal.
A investigação sobre a divulgação dos diálogos foi associada ao inquérito das fake news, que investiga ataques, ofensas e ameaças aos ministros. Alexandre de Moraes justificou que o ""vazamento deliberado de informações"" pode estar associado a uma ""atuação estruturada de uma possível organização criminosa que tem por um de seus fins desestabilizar as instituições republicanas"".
A ação que está sendo preparada por Eduardo Kuntz também deve usar trechos do Código Penal que estabelecem as regras de impedimento para magistrados atuarem em investigações e processos criminais.
Essa não é a primeira investigação aberta de ofício por Alexandre a partir de episódios que o envolvem. Isso também ocorreu no inquérito sobre as hostilidades que sofreu no aeroporto de Roma. Foi o ministro quem mandou instaurar a investigação. No entanto, naquele processo, houve a redistribuição ao gabinete de Dias Toffoli.
Como mostrou a Coluna do Estadão, colegas do STF avaliam que Moraes deveria abrir mão da relatoria do caso para evitar desgastes ou questionamentos sobre sua atuação."		2024-08-24T12:46:00-03:00		https://noticias.uol.com.br/ultimas-noticias/agencia-estado/2024/08/24/ex-assessor-de-moraes-quer-barrar-inqueritos-abertos-espontaneamente-por-ministros-do-stf.htm	UOL
130	TRE-MA faz auxiliares virarem chefes de si mesmas para inflar cota feminina	"O TRE-MA (Tribunal Regional Eleitoral do Maranhão) mudou os nomes de 33 cargos e transformou assistentes em ""chefes de si mesmas"" para ampliar o número de mulheres em cargos de comando, um dos critérios levados em conta pelo CNJ (Conselho Nacional de Justiça) para avaliar tribunais.
O que aconteceu
Tribunal alterou nomes de cargos sem mudança de atribuições nem aumento de salário. Responsável por fiscalizar e julgar as campanhas eleitorais do Maranhão, inclusive para avaliar os cumprimentos das cotas de gênero e minorias nas candidaturas, o TRE-MA aprovou em julho uma resolução que alterou a nomenclatura de 56 cargos na Corte Eleitoral, sem criar novos gastos ou mesmo trocar as atribuições dos servidores.
Aumento de ""chefes"". Após a mudança, em 33 casos, servidores com função de ""assistente"" passaram a ser chamados de ""chefes"" em seus respectivos setores. Deste total, em apenas dois casos as pessoas que mudaram de cargo eram homens. 
Chefes apenas de si mesmas. Em quatro casos, a reportagem identificou que as novas ""chefes"" são as únicas servidoras do setor. Há também 15 casos de ""chefes"" mulheres em setores que contam somente com pessoas em cargos superiores. 
Mais ""chefe"" do que outras. Um setor acabou ficando com quatro ""chefes"" e um ""assistente"". Dos quatro líderes, o que possui o cargo de hierarquia mais alta é um homem, que ocupa o posto de ""chefe de seção"". As outras três mulheres se tornaram chefes justamente com a resolução aprovada em julho. 
Outro setor tem somente três servidores. Duas mulheres eram assistentes e viraram ""chefes"". Um homem é superior delas.
Homens ficaram como assistentes. Nos quadros do tribunal, a reportagem ainda identificou seis casos de servidores homens com o mesmo nível hierárquico das ""chefes"" mulheres que mantiveram as nomenclaturas antigas, de ""assistentes"". O levantamento não leva em conta os dados de servidores terceirizados, que não estão sujeitos às mudanças de nomenclatura.
O TRE fala em ""valorização da participação feminina nas funções de liderança"". Diz ainda que ""já teve oportunidade de editar mais de 17 resoluções com a mesma finalidade nos últimos três anos"" (leia mais ao final da reportagem). ""Atualmente, temos 244 homens e 155 mulheres, o que, a despeito dos esforços deste tribunal, ainda denota uma menor quantidade de mulheres em cargos e funções comissionadas, realidade que se pretende mudar ao longo dos próximos anos.""
Presidente disse ser só mudança de nome. Ao aprovar a resolução em julho, o presidente do TRE-MA afirmou que a proposta buscava somente mudar a denominação dos cargos. O desembargador José Gonçalo de Sousa Filho deixou claro que não criaria nenhum cargo. A alteração foi aprovada pelo plenário em 15 de julho.
Eu adianto que nenhuma dessas resoluções cria qualquer despesa, alteram só a denominação e remanejam o cargo para outro lugar. Não estamos criando nenhum cargo, apenas alterando a denominação e remanejando.José Gonçalo de Sousa Filho, presidente do TRE-MA, em sessão que criou os novos cargos de chefia
Disputa entre tribunais
Na prática, tribunal infla número de chefias comandadas por mulheres. O Conselho Nacional de Justiça, responsável por fiscalizar os tribunais de todo o país, instituiu uma política nacional de incentivo à participação feminina que estabelece que os tribunais devam buscam medidas para promover a igualdade de gênero. Dentre essas medidas está o incentivo para que mulheres assumam, por exemplo, mais cargos de comando. 
Indicador é usado para avaliar tribunais. Todo ano o CNJ avalia os tribunais de todo o país para conceder o Prêmio CNJ de Qualidade, a partir de vários critérios. Um deles é a nomeação de mulheres para cargos de chefia. Os tribunais mais bem avaliados ganham diferentes selos, em uma espécie de competição para avaliar a melhor gestão. 
No ano passado, o TRE-MA recebeu o selo ""Diamante"", o segundo melhor. Na ocasião, somente o Tribunal Regional Eleitoral de Mato Grosso do Sul recebeu o selo ""Excelência"", em primeiro lugar.
Outro lado
Por meio de nota, tribunal afirmou que mudanças buscaram adequar natureza dos cargos. O secretário de Gestão de Pessoas do Tribunal, Gilson Borges, informou que o TRE-MA iniciou um projeto de reestruturação administrativa em 2023 e que levou à revisão de todos os cargos e funções para deixar ""mais claras"" as atribuições dos servidores. Segundo ele, neste contexto foi estabelecida a premissa de valorizar a participação feminina nas funções de liderança.
Além disso, tribunal diz que eventuais mudanças de atribuições ainda serão regulamentadas. Secretário também afirmou que a existência de profissionais de níveis hierárquicos diferentes é comum no serviço público e que podem haver relações de subordinação entre um servidor de menor hierarquia que seu subordinado.
Reportagem também questionou o CNJ, sem sucesso. Foram enviadas perguntas por email e foi feito contato por telefone, mas o CNJ não respondeu até a última atualização desta reportagem. O espaço segue aberto.
A existência de vários níveis hierárquicos é inerente à estrutura organizacional da administração pública. Assim, em uma mesma unidade organizacional, é possível haver relação de subordinação entre um servidor(a) que ocupe função e outro(a) a quem esteja subordinado(a) hierarquicamente. Nota do Tribunal Regional Eleitoral do Maranhão
As alterações nas nomenclaturas levaram em conta o exercício de atividades relacionadas ao planejamento, coordenação, monitoramento e controle, distinguindo-as das atribuições de assessoramento.Nota do Tribunal Regional Eleitoral do Maranhão"	Mateus Coutinho	2024-08-24T12:00:00-03:00		https://noticias.uol.com.br/politica/ultimas-noticias/2024/08/24/tribunal-transforma-assistentes-em-chefes-para-ampliar-cota-de-mulheres.htm	UOL
131	Pacheco defende prudência em pedido de impeachment de Moraes	"O presidente do Senado, Rodrigo Pacheco (PSD-MG), defendeu prudência na análise de pedidos de impeachment do ministro do Supremo Tribunal Federal (STF) Alexandre de Moraes, que ganharam tração nos últimos dias. A declaração foi feita em um evento de homenagem da Universidade Federal de Minas Gerais (UFMG) ao parlamentar, nesta sexta-feira, 23.
Pacheco foi questionado por jornalistas sobre a ofensiva que ganhou força sobretudo entre bolsonaristas após após o jornal Folha de São Paulo mostrar que Moraes ordenou, de forma não oficial, a produção de relatórios pelo Tribunal Superior Eleitoral (TSE) para embasar suas decisões contra aliados do ex-presidente Jair Bolsonaro (PL).
O Estadão mostrou que na semana passada que Pacheco não via clima para pautar o impeachment, segundo seus aliados. Membros da tropa de choque de apoio a Bolsonaro no Senado, como Eduardo Girão (PL-CE) e Damares Alves (Republicanos-DF) passaram a endossar a saída de Moraes do cargo.
""Eu, como presidente do Senado, depois de três anos e sete meses, vou ter muita prudência em relação a esse tipo de tema para não permitir que esse país vire uma esculhambação de quem quer acabar com ele"", declarou o senador no evento em Minas Gerais, na sexta-feira.
Em seguida, Pacheco afirmou ter responsabilidade com o seu cargo e com a democracia, e que uma medida drástrica como o impeachment de um ministro do STF afetaria a economia, a inflação, o dólar e o desemprego. E lembrou que negou um pedido contra o mesmo ministro, apresentado por Bolsonaro em 2021, por não ter viabilidades jurídica e política.
O presidente do Senado ainda alfinetou deputados da oposição que agora pedem a deposição de Moraes ao mencionar que aprovou na Casa uma proposta de emenda à Constituição (PEC) para limitar o poder de decisões monocráticas, isto é, individuais, de ministros do STF. A proposta, no entanto, ficou parada com os deputados até o último dia 16, quando o presidente da Câmara, Arthur Lira (PP-AL), a enviou para a Comissão de Constituição e Justiça (CCJ), após a Corte formar maioria no plenário para manter a decisão do ministro Flávio Dino de suspender as emendas parlamentares ao Orçamento.
""É incrível que esses mesmos que pedem impeachment de ministro do STF se calaram durante oito meses, depois de eu ter aprovado no Senado essa PEC das decisões monocráticas. Como se pretendessem não a solução do problema de limitar Poderes institucionais, mas que pretendessem a lacração em rede social, pautado no desequilíbrio e medidas de ruptura"", declarou."		2024-08-24T08:31:00-03:00	2024-08-24T12:10:57-03:00	https://noticias.uol.com.br/ultimas-noticias/agencia-estado/2024/08/24/pacheco-defende-prudencia-em-pedido-de-impeachment-de-moraes.htm	UOL
132	Alemanha prende segunda pessoa após atentado à faca em festa popular	"A polícia alemã anunciou, neste sábado (24), que prendeu uma segunda pessoa na investigação do ataque mortal a facadas ocorrido na sexta-feira em um festival popular em Solingen, reivindicado pela organização Estado Islâmico, cujo autor está foragido.
A prisão foi anunciada quando forças especiais realizavam uma grande operação em um centro de recepção de refugiados próximo ao local do ataque, que deixou três mortos e quatro gravemente feridos.
A polícia já havia informado a prisão de um adolescente de 15 anos de idade sob suspeita de ""deixar de relatar"" um ato criminoso.
Testemunhas relataram tê-lo visto conversando com um indivíduo que poderia ser o autor do ataque, disse o promotor público de Düsseldorf, Markus Caspers.
Os mortos são dois homens de 56 e 67 anos e uma mulher de 56. Oito pessoas ficaram feridas, quatro delas gravemente.
A festa onde aconteceu o esfaqueamento foi um dos vários eventos planejados para comemorar o 650º aniversário da fundação de Solingen, uma cidade no oeste do país."		2024-08-24T17:06:46-03:00		https://noticias.uol.com.br/ultimas-noticias/afp/2024/08/24/alemanha-prende-segunda-pessoa-apos-atentado-a-faca-em-festa-popular.htm	UOL
133	Suspensão de perfis de Marçal racha direita e cria saia justa para Nunes	"A suspensão dos perfis de Pablo Marçal (PRTB) rachou a direita e criou uma saia justa para o prefeito Ricardo Nunes (MDB), que é apoiado pelo ex-presidente Jair Bolsonaro (PL)
Lideranças e influenciadores dessa corrente política estão reclamando de ""censura"" contra o candidato do PRTB à prefeitura de São Paulo. Ex-ministro da Justiça de Bolsonaro, o senador Sergio Moro (União Brasil) escreveu em sua conta na rede X:
""Suspender as redes sociais de um candidato - qualquer candidato - liminarmente e sem defesa é uma agressão à liberdade de expressão e política. Se existe impulsionamento ilegal, que se corrija isso e não suspenda tudo. A Justiça precisa ter proporção.""
O deputado federal Ricardo Salles (Novo) - que cogitou ser candidato mas foi preterido pelo PL para apoiar Nunes - fez uma referência indireta. ""O sistema é f..."", escreveu.
Conforme antecipou a coluna, a Justiça Eleitoral concedeu uma liminar em ação movida pela campanha da candidata Tabata Amaral (PSB) suspendendo as redes sociais de Marçal até o fim das eleições municipais.
Os perfis continuam no ar até a notificação oficial pelas plataformas, o que deve ocorrer em breve. Marçal, no entanto, já está convocando seus seguidores para novos perfis e para o WhatsApp e se posicionando com uma ""vítima do sistema"".
O PSB argumenta que o candidato do PRTB comete abuso de poder econômico ao pagar seguidores para fazer ""cortes"" e promover sua campanha nas redes sociais. Ele nega.
O cumprimento das regras eleitorais e a defesa da própria democracia versus a liberdade de expressão é um debate que movimenta a direita e a esquerda no Brasil desde 2018 e chegou a ser alvo de um projeto de lei sobre a regulamentação das plataformas no Congresso.
Só que agora Nunes e seu padrinho político, Bolsonaro, estão do lado de quem está sendo prejudicado pelo candidato que joga fora das regras do jogo.
Em guerra aberta contra Marçal, que vem tirando votos de Nunes entre os bolsonaristas, a família Bolsonaro demorou a comentar a suspensão das contas do candidato do PRTB. O receio era apoiar Marçal ou parecer que defendem ""censura"". No início da noite, o ex-presidente usou as redes sociais para ""independente de quem seja, não concordo com censura, tá ok?""
Fábio Wajngarten, ex-secretário de Comunicação, foi um dos pouco a falar sobre o assunto:
""Perseguido foi o presidente Bolsonaro, você cavou esse pênalti aí. Daqui a pouco vai dizer que o Marcola também é perseguido. Faz o M de mensalinho"", escreveu Wajngarten.
Buscando não desagradar os eleitores bolsonaristas, Nunes se posicionou contra a liminar, sem apoiar Marçal.
""Sou contra qualquer tipo de censura. A regra tem que ser igual para todos. Ou a Justiça libera todos os candidatos para fazerem o mesmo, ou ninguém utiliza estrutura paralela com cortes impulsionados"", escreveu o prefeito no X.
Segundo apurou a coluna, a campanha do prefeito decidiu não entrar na Justiça contra Marçal para solicitar a cassação da candidatura exatamente para evitar que ele se transformasse em mártir e Nunes num defensor da ""censura""."	Raquel Landim	2024-08-24T15:35:45-03:00		https://noticias.uol.com.br/colunas/raquel-landim/2024/08/24/suspensao-de-perfis-de-marcal-racha-direita-e-cria-saia-justa-para-nunes.htm	UOL
134	Emparedado por Maduro, Lula exibe uma nudez democrática	"Pior do que a nudez inesperada é o nu que não causa espanto. Ao avalizar nesta semana a fraudulenta reeleição de Nicolás Maduro, o Tribunal Supremo de Justiça da Venezuela impôs a Lula o pior tipo de impudor: a indecência que ninguém pediu para ver, embora todos já intuíssem que o presidente brasileiro ficaria, por assim dizer, com o derrière exposto na janela.
Na noita desta sexta-feira, Lula conversou por telefone com o presidente da Colômbia, Gustavo Petro. Ambos buscavam uma saída negociada para a crise venezuelana. Intimados pelas circunstâncias a se reposionar, ainda hesitam em reconhecer o óbvio. Combinaram uma nova conversa para a próxima semana.
A articulação incluía também o presidente mexicano Andrés López Obrador. Entretanto, acometido pela síndrome do que estava por vir, Obrador retirou-se da negociação. Livrou-se preventivamenre do constrangimento de admitir em público a obviedade de que a Venezuela tornou-se uma ditadura clássica.
O constrangimento é maior para Lula. Na semana passada, tropeçando no óbvio, Lula declarou que ""a Venezuela vive um regime muito desagradável"". Admitiu que Maduro adquiriu um ""viés autoritário"". Mas sustentou que o país vizinho ""ainda não é uma ditadura"".
Acorrentado a vícios ideológicos do passado, Lula demora a se dar conta de que, aplicando-se os seus conceitos à conjuntura brasileira, Bolsonaro, admirador confesso da ditadura militar, não seria senão um personagem ligeiramente antidemocrático. O 8 de janeiro e o golpe falhado, que previa a anulação da vitória do próprio Lula, seriam meras contingências aceitáveis.
Lula ainda defendia a hipótese de superação do caos venezuelano por meio da realização de uma utópica nova eleição. A transposição da fórmula para a realidade brasileira conduziria à suposição absurda de que Lula e o PT aceitariam graciosamente a submissão do resultado das urnas de 2022 a um tira-teima, uma espécie de VAR eleitoral.
No calor da fraude da autoproclamação de sua reeleição, Maduro prometera ao assessor internacional de Lula, Celso Amorim, que divulgaria as atas com os resultados individualizados das seções eleitorais da Venezuela em ""dois ou três dias"". Com a rapidez de um raio, o ditador voltou atrás. 
Maduro alegou que um hipotético ataque hacker mergulara a Venezuela numa ""batalha cibernética nunca antes vista"". Transferiu as atas ocultas da Comissão Nacional Eleitoral, espécie de TSE venezuelano, sob domínio chavista, para o manietado Tribunal Supremo de Justiça.
Conforme o mundo esperava, a Corte Suprema da Venezuela, outra instância submetida às conveniências do ditador, avalizou a fraude. Pior: proibiu a divulgação das atas eleitorais. Muito pior: preparou o terreno para a prisão do rival oposicionista Edmundo González e de de sua madrinha política María Corina.
Emparedada, a diplomacia brasileira evolui rapidamente do constrangimento para o vexame. Não é que Lula seja um observador inerte da derrocada do regime venezuelano. O problema é que, no limite, ele é corresponsável pela encrenca, pois sempre contemporizou com o depravação do chavismo.
Em 2013, quando sua criatura Dilma Rousseff era inquilina do Planalto, Lula gravou um vídeo para uma campanha de Maduro. Na peça, dizia que a gestão do ditador repesentava ""a Venezuela que Chávez sonhou"". No ano passado, desenrolou o tapete vermelho para recepcionar Maduro em Brasília. 
Lula defendeu a reinserção do vizinho no Mercosul. Disse que a ditadura venezuelana não passava de ""narrativa"" ficcional. Sustentou que a democracia é um conceito ""relativo"". Deu no que está dando.
Considerando-se que Maduro produz o maior flagelo humanitário da história do continente, aterrorizando os venezuelanos com a morte de manifestantes, a prisão indiscriminada de patrícios sublevados e a potencialização da diáspora venezuelana, a consequência da leniência do Planalto é politicamente devastadora.
Num instante em que metade da sociedade brasileira respira aliviada por ter conseguido livrar o Brasil do projeto ditatorial de Bolsonaro pela margem mixuruca de 1,8 ponto percentual dos votos, Lula converte a derrocada de Maduro num processo de erosão da sua popularidade. É como se o xamã do petismo disputasse com o capitão golpista o posto de líder da oposição.
Na teoria, o Itamaraty mantém o compromisso de não reconhecer a vitória de Maduro enquanto não vierem à luz as atas da eleição de 28 de julho. Na prática, submetido à contingência de que o rompimento de relações com a Venezuela não convém ao Brasil, a diplomacia brasileira reconhece tacitamente a reeleição fraudulenta do ditador, condenando-se a conviver com ele."	Josias de Souza	2024-08-24T01:57:22-03:00		https://noticias.uol.com.br/colunas/josias-de-souza/2024/08/24/emparedado-por-maduro-lula-exibe-uma-nudez-democratica.htm	UOL
135	"O É DA COISA: Pablo, PCC e a questão: ""Quem tem a coragem de Xandão em SP""?"	Qual é a diferença entre Pablo Marçal e o bolsonarismo? Só a origem. O resto é farinha do mesmo reacionarismo.	Reinaldo Azevedo	2024-08-24T01:56:44-03:00		https://noticias.uol.com.br/colunas/reinaldo-azevedo/2024/08/24/o-e-da-coisa-pablo-pcc-e-a-questao-quem-tem-a-coragem-de-xandao-em-sp.htm	UOL
136	Volto aos EUA para cobrir diretamente de NY as eleições em um país rachado	"Desembarco hoje nos Estados Unidos. Pelos próximos meses e até 2025, esta coluna passará a ser escrita de Nova York, centro do poder, da criatividade, de desconcertantes contradições sociais, de diplomacia, de hipocrisia e de muita cultura.
Exatos 40 anos depois de minha primeira estadia nos EUA, volto para ser testemunha de um dos períodos mais fundamentais da história recente do país.
Uma encruzilhada de uma nação que ditou, nem sempre por instrumentos democráticos, as regras comportamentais, culturais, tecnológicas e econômicas para uma parcela da humanidade.
Venho para escutar, desconstruir clichês, tentar entender a complexidade de uma sociedade que passa, mais uma vez, por uma verdadeira batalha por sua alma. Uma potência sobre a qual paira a pergunta incômoda sobre sua decadência ou reinvenção.
Em novembro, um país rachado vai às urnas, sob a sombra de um complexo industrial da desinformação. Uma eleição marcada, entre outras coisas, por uma campanha que promete uma ""deportação em massa"" de pessoas que nunca foram de outra nação.
Não será a primeira vez que o país se olhará no espelho e terá de fazer perguntas difíceis. A história —e seus ecos— nos revelam a profundidade da opressão e desigualdade que mulheres, imigrantes, indígenas e afroamericanos escravizados viveram, antes de poderem ser considerados cidadãos.
Tampouco será a primeira vez que um grupo lutará por manter o que acredita ser o ""American Way of Life"".
Em 1948, por exemplo, o governador segregacionista da Carolina do Sul, Strom Thurmond, estava concorrendo à Presidência por um partido que lutava contra os direitos civis. Num discurso, ele alertou que o projeto de Harry Truman para proibir o linchamento e a discriminação na contratação de empregados ""minaria o modo de vida americano"". Foi ovacionado.
A história americana revela como profundas divisões, rancores e protestos moldaram esse país. Um Destino Manifesto que justificou um massacre de povos inteiros. Um país que, por séculos, construiu sua ""grandeza"" sob um apartheid explícito, transformado hoje em implícito.
Mas também um país da luta inspiradora por direitos. Um país de Martin Luther King e Rosa Parks, da genialidade de Nina Simone, Jasper Johns e tantos outros.
Nos próximos meses, o que está em jogo não é apenas a escolha de quem ocupará a Casa Branca. Mas o destino de políticas que podem afetar milhões de pessoas no Haiti, na Venezuela, na Palestina, na Ucrânia, em Cuba, no Sudão, na China e mesmo no Brasil.
Por giros inesperados da vida, será desse posto privilegiado de observação que também olharei para os desafios da ONU e sua burocratização da utopia. Uma entidade que, para muitos, está sob os escombros de Gaza.
O sistema multilateral criado em 1945 e com sede em Nova York já não é suficiente para dar respostas aos atuais desafios e para um mundo que viu seus eixos de poder migrarem. A pandemia acelerou a desconstrução de um mundo. Mas não há quem ouse decifrar o que virá em seu lugar.
A disputa pelo poder está em andamento em cada canto do planeta em ebulição. E esse movimento tem um capítulo fundamental aqui, nesta encruzilhada eleitoral e existencial nos EUA.
Welcome on board. A viagem promete ser fascinante."	Jamil Chade	2024-08-24T12:00:00-03:00		https://noticias.uol.com.br/colunas/jamil-chade/2024/08/24/jamil-chade-passa-a-escrever-coluna-a-partir-de-nova-iorque.htm	UOL
