	title	content	autors	date	update_date	url	source
0	Guia que se masturbou durante mergulho com turista em Maragogi é preso	"Um guia de turismo foi preso na manhã desta quinta-feira (22). Ele foi gravado se masturbando enquanto acompanhava uma turista em um mergulho em Maragogi (AL).
O que aconteceu
O homem, de 32 anos, é acusado de importunação sexual. O crime ocorreu há sete anos nas piscinas naturais de uma das praias mais famosas de Alagoas, mas o mandado de prisão só foi cumprido agora.
Crime foi registrado por uma câmera, que serviu como prova durante o processo criminal. As imagens mostraram o guia se masturbando enquanto leva a vítima em um mergulho com cilindro de ar comprimido e máscara.
Mulher descobriu a importunação após ver a gravação. O passeio havia sido contratado em um hotel do município. As identidades dos envolvidos não foram divulgadas.
Prisão preventiva do suspeito foi decretada em novembro de 2023. A decisão foi dada pelo Vara de Único Ofício de Maragogi e foi cumprida por policiais da DPTur.
É importante que toda a sociedade se conscientize para combater e denunciar esses crimes. As mulheres fiquem atentas a qualquer movimento que considere suspeito e denunciem. Nós estamos atentos a casos como esse Luci Mônica, delegada"		2024-08-22T11:59:48-03:00		https://noticias.uol.com.br/cotidiano/ultimas-noticias/2024/08/22/guia-e-preso-apos-se-masturbar-durante-mergulho-com-turista-em-maragogi.htm	UOL
1	Cidade de São Paulo terá queda de temperatura de até 22ºC em 48 horas	"A temperatura deve despencar até 22°C na cidade de São Paulo em apenas dois dias, conforme previsão do tempo divulgada pelo instituto de meteorologia Climatempo.
O que aconteceu
Capital paulista deve ter choque térmico nas próximas 48 horas. Segundo o instituto, a cidade de São Paulo ainda deve registrar até 32°C na sexta-feira (23), mas a temperatura máxima no sábado (24) não deve passar dos 22°C. Já no domingo (24), o dia promete ser gelado e chuvoso com menos de 10°C durante a madrugada, graças à frente fria que deve avançar para o Sudeste.
Chuva deve melhorar a qualidade do ar na cidade. A última passagem de forte frente fria, em 10 de agosto, provocou a chuva com 43,8 mm, superando a média histórica para agosto na capital paulista, que é de 32 mm.
Levantamento do Climatempo mostra que capital paulista teve poucos dias com chuva em cinco meses. Foram sete dias em abril, cinco em maio, nenhum em junho, dois em julho e dois em agosto até agora.
abril: 7 dias com chuvamaio: 5 dias com chuvajunho 0 dia com chuvajulho: dois dias com chuvaagosto: 2 dias em 20 dias até agora
Onda de calor fez Defesa Civil decretar estado alerta na capital. No último sábado (17), São Paulo teve o menor índice médio de umidade relativa do ar dos últimos três anos, com 20,5%. No domingo, a capital paulista teve a menor umidade relativa do ar absoluta de 2024: 13,2%, registrados na estação meteorológica automática da Sé, segundo o CGE (Centro de Gerenciamento de Emergências)."		2024-08-22T16:17:32-03:00		https://noticias.uol.com.br/cotidiano/ultimas-noticias/2024/08/22/previsao-tempo-calor-frio-temperatura-sao-paulo-sp.htm	UOL
2	Mega-Sena acumula e prêmio sobe para R$ 33 milhões; veja dezenas sorteadas	"Ninguém acertou as seis dezenas sorteadas hoje no concurso 2765 da Mega-Sena.
O que aconteceu:
Os números sorteados foram 08-12-34-39-43-47.
O próximo concurso será realizado no sábado, com prêmio estimado de R$ 33 milhões. 
66 apostas acertaram cinco dezenas e ganharam R$ 35.663,33. 
Houve 3.707 jogos vencedores com quatro números; cada um deles fatura R$ 907,07. 
Como faço para participar do próximo sorteio da Mega-Sena?
Você precisa fazer uma aposta de seis a 20 números nas lotéricas credenciais pela Caixa, ou no site especial de loterias do banco. Participam do próximo concurso todas as apostas registradas até 19h do dia do sorteio.
Quanto custa apostar na Mega-Sena?
Depende de quantos números você pretende colocar no jogo. A aposta mínima custa R$ 5, e você tem direito de escolher seis dezenas de 1 a 60. Se quiser colocar um número a mais para aumentar as chances de acerto, o preço do jogo sobe para R$ 35.
Quais foram os maiores prêmios dos concursos regulares da Mega-Sena?
2.525, 01/10/2022, 2 apostas vencedoras; premiação total: R$ 317,8 mi2.150, 11/5/2019, 1 aposta vencedora; premiação total: R$ 289,4 mi2.237, 27/2/2020; 2 apostas vencedoras; premiação total: R$ 211,6 mi2.696, 05/3/2024; 1 aposta vencedora; premiação total: R$ 206,4 mi1.764, 25/11/2015; 1 aposta vencedora; premiação total: R$ 205,3 mi1.772, 22/12/2015; 2 apostas vencedoras; premiação total: R$ 197,4 mi2.463, 19/03/2022; 2 apostas vencedoras; premiação total: R$ 189,3 mi2.745, 04/07/2024; 3 apostas vencedoras; premiação total: 162,7 mi2.562, 08/02/2023; 2 apostas vencedoras; premiação total: 152,8 mi1.655, 22/11/2014; 2 apostas vencedoras; premiação total: R$ 135,3 mi2.548, 14/12/2022; 1 aposta vencedora; premiação total: R$ 134,8 mi2.161, 19/6/2019; 1 aposta vencedora; premiação total: R$ 124,2 mi2.189, 18/9/2019: 1 aposta vencedora; premiação total: R$ 120 mi1.220, 6/10/2010; 1 aposta vencedora; premiação total: R$ 119,1 mi
E quais são as minhas chances de ganhar na Mega-Sena?
Isso também varia de acordo com a quantidade de dezenas na sua aposta. Com a menor (R$ 5), com seis números, a chance de acertar todas as bolinhas sorteadas e faturar o prêmio maior é de uma em 50.063.860. Jogando uma dezena a mais (R$ 35), a probabilidade aumenta. Passa a ser de uma em 7.151.980. Quem estiver disposto a pagar mais de R$ 25 mil na aposta com 15 dezenas terá uma chance em 10.003 de cravar tudo e ficar milionário.
Se você desembolsar R$ 40 mil e jogar 16 números, terá uma chance em 6.252; com 17 números e R$ 61,8 mil investidos, você tem uma chance em 4.045; com 18 números você paga mais de R$ 92,8 mil e tem uma chance em 2.697; com 19 números desembolsa mais de R$ 135 mil e sua chance será uma em 1.845; e com 20 números você paga o valor máximo de R$ 193,8 mil e tem uma chance em 1.292.
Como funciona o bolão que a Caixa vende nas lotéricas?
Esses bolões são organizados pelas próprias lotéricas credenciadas pela Caixa. São apostas em grupo com preço mínimo estipulado em R$ 15 no caso da Mega-Sena. A cota mínima obrigatória por participante é de R$ 6. Nessa modalidade, pode existir uma taxa de serviço adicional de 35% do valor da cota. O bolão da Mega-Sena permite de duas a 100 cotas. Em cada bolão, é possível fazer dez apostas diferentes.
Tem mais dúvidas? Confira as respostas às perguntas mais frequentes sobre a Mega-Sena."		2024-08-22T20:02:30-03:00	2024-08-22T20:50:39-03:00	https://noticias.uol.com.br/ultimas-noticias/2024/08/22/mega-sena-concurso-2765-sorteio-22-de-agosto.htm	UOL
3	Mal cabe na palma da mão: diamante de 2.492 quilates é encontrado em Botsuana	"Um dos maiores diamantes já encontrados até hoje, de 2.492 quilates e que mal cabe na palma da mão, foi encontrado em uma mina em Botsuana, maior produtor africano deste tipo de pedra preciosa, anunciou nesta quinta-feira a empresa de mineração canadense Lucara.
O diamante, encontrado na mina de Karowe, nordeste do país, é ""um dos maiores diamantes brutos já descobertos"", afirmou a empresa em um comunicado.
Também é o maior diamante encontrado em Botsuana, destacou a presidência do país do sul do continente africano em outro comunicado.
Em quilates, não está muito distante do maior diamante conhecido no mundo, o ""Cullinan"", de mais de 3.100 quilates, encontrado na África do Sul em 1905.
""Estamos em êxtase com a recuperação deste diamante extraordinário de 2.492 quilates"", disse o CEO da Lucara, William Lamb.
A empresa não revelou o valor da descoberta, nem sua qualidade, mas apresentará a descoberta à imprensa durante a tarde em Gaborone. O diamante também será exibido ao presidente Mokgweetsi Masisi.
Botsuana, com 2,6 milhões de habitantes, é um dos maiores produtores mundiais de diamantes, sua principal fonte de recursos.
No comunicado, a Lucara afirma que os recursos proporcionam a Botsuana ""benefícios socioeconômicos consideráveis"", como a possibilidade de financiar ""setores essenciais como educação e saúde"", assim como o setor de infraestruturas.
Antes da descoberta anunciada nesta quinta-feira, o maior diamante encontrado em Botsuana era uma pedra de 1.758 quilates, também extraída pela Lucara em 2019 e batizada como 'Sewelo'."		2024-08-22T06:01:47-03:00		https://noticias.uol.com.br/ultimas-noticias/afp/2024/08/22/empresa-canadense-encontra-um-dos-maiores-diamantes-do-mundo-em-botsuana.htm	UOL
4	Energia é retomada no Acre e em Rondônia após quase 4 h de apagão, diz ONS	"O ONS (Operador Nacional do Sistema Elétrico) confirmou na noite desta quinta-feira (22) que restabeleceu integralmente a energia nos estados do Acre e Rondônia após quase quatro horas de apagão.
O que aconteceu
Restabelecimento integral foi concluído às 20h40. A interrupção da carga ocorreu às 16h47 e afetou 75% da rede (cerca de 218 mil consumidores) no Acre e 84% da rede (aproximadamente 572 mil) em Rondônia, segundo a Energisa, concessionária de energia responsável pelo fornecimento nos estados.
Concessionária disse que um problema externo no SIN (Sistema Interligado Nacional) provocou a interrupção no sistema que abastece os estados. ""Assim que identificou a situação, o Operador iniciou ação conjunta com os agentes para restabelecer a energia nas regiões. A recuperação do serviço foi sendo concluída por fases e comunicada à sociedade no site do operador.""
Nesta quinta-feira, altas temperaturas atingem Acre e Rondônia. Em Rio Branco, a temperatura mínima é de 22ºC e máxima de 37ºC. Já Porto Velho registra a mínima de 23ºC e a máxima de 37ºC, segundo o Climatempo.
""Na ocorrência, houve o desligamento automático do Complexo de geração e transmissão CC do Madeira e a desconexão do Sistema Elétrico do Acre/Rondônia do SIN, provocando o desligamento das cargas do estado do Acre e Rondônia.""
O ONS destacou ainda que as causas da interrupção ainda estão sendo apuradas. ""Elas serão divulgadas em relatório a ser emitido pelo ONS, posteriormente"", acrescentou.
Sala de situação foi aberta
Ministro Alexandre Silveira determinou a abertura imediata de sala de situação. Também em nota, o Ministério de Minas e Energia disse que a sala contaria com participação do ONS, da Aneel (Agência Nacional de Energia Elétrica) e do corpo técnico da pasta para garantir celeridade à recomposição do sistema e acompanhar as demais tratativas sobre a ocorrência.
""A previsão é que todo o serviço seja restabelecido nas próximas horas"", disse o ministério mais cedo. A pasta disse ainda que as condições de atendimento do sistema elétrico brasileiro permanecem confiáveis em todo território nacional.
(*Com Reuters)"		2024-08-22T19:02:18-03:00	2024-08-23T00:07:35-03:00	https://noticias.uol.com.br/cotidiano/ultimas-noticias/2024/08/22/acre-rondonia-falta-de-energia-agosto-2024.htm	UOL
5	Moraes manda PF apreender celular de ex-assessor após mensagens vazadas	"O ministro do STF (Supremo Tribunal Federal) Alexandre de Mores determinou nesta quinta-feira (22) a apreensão do celular de seu ex-assessor Eduardo Tagliaferro, para investigar o possível vazamento de mensagens compartilhadas entre ele e o juiz auxiliar do gabinete de Moraes que foram reveladas pelo jornal Folha de S.Paulo.
O que aconteceu
Decisão do ministro atende a pedido da PF e da PGR. Tagliaferro depôs nesta quinta à Polícia Federal em São Paulo e, segundo a PF, se negou a entregar seu aparelho celular para a perícia. Para a delegada Luciana Matutino Caires, responsável pelo caso, é necessária a análise dos arquivos e comunicações que possam estar no celular de Tagliaferro para elucidar os fatos. 
O aparelho foi apreendido no final da oitiva na PF.
Defesa classificou apreensão como incomum. O advogado de Tagliaferro, Eduardo Kuntz, classificou a medida como ""abuso de autoridade"" e ""excesso de poder"" e que seu cliente prestou depoimento como testemunha. 
Inquérito foi aberto após revelações da Folha de S.Paulo. Polícia Federal investiga possível crime de violação de segredo funcional e tenta identificar quem teria vazado as conversas entre Tagliaferro e Airton Vieira, juiz auxiliar do gabinete de Alexandre de Moraes. O próprio Moraes é o relator do inquérito que investiga seu ex-auxiliar.
À PF, ex-auxiliar disse que aparelho celular foi 'corrompido'. Em um depoimento de cerca de duas horas, Tagliaferro disse que entregou o aparelho na delegacia de Caieiras (Grande SP), onde foi detido em 9 de maio do ano passado, e que recebeu o aparelho seis dias depois ""corrompido"", com problemas com a bateria, por exemplo, e diferente do que era quando foi apreendido.
Tagliaferro chefiava a AEED (Assessoria Especial de Enfrentamento à Desinformação), do TSE (Tribunal Superior Eleitoral). Na época, Moraes presidia o tribunal, e Tagliaferro deixou o cargo após ser preso por violência doméstica, em maio do ano passado. Ele foi exonerado do cargo no TSE no mesmo dia.
Folha revelou uso informal da estrutura do TSE para abastecer investigações no STF. Série de reportagens mostrou diálogos entre Tagliaferro e o juiz Airton Vieira, que atua com auxiliar do gabinete de Moraes no STF. Mensagens mostram magistrado pedindo, via WhatsApp, a produção de relatórios sobre postagens de pessoas que estavam sob investigação no inquérito das fake news, sob a relatoria de Moraes no Supremo.
Relatórios foram utilizados na investigação do STF para embasar medidas contra os investigados. Segundo a Folha, nem sempre os documentos eram formalizados como relatórios produzidos no TSE e, em alguns casos, Airton pediu alterações ou mesmo passou instruções sobre como os relatórios deveriam ser produzidos. O próprio Airton Vieira admite, em mensagens reveladas pela Folha, que os pedidos poderiam levar a questionamentos.
Inquérito de ofício. O ministro Alexandre de Moraes decidiu abrir o inquérito por iniciativa própria. Na prática o ministro decidiu com base em matérias, postagens em redes sociais.
BO da apreensão do celular. O ministro também cita o boletim de ocorrência da apreensão do celular de Tagliaferro, que está disponível na internet.
Fake News contra as instituições. Sem ser provocado, ministro entendeu que vazamentos serias semelhantes a atuação de grupos bolsonaristas investigados no inquérito das fake news e, por isso, determinou uma nova investigação, distribuída para ele mesmo ser o relator para apurar o vazamento das mensagens.
Conteúdo de celular de assessor veio a público pela imprensa. Para Moraes, o vazamento teria objetivo de ""desestabilizar instituições republicanas"". Em nenhum momento, porém, ele atribui algum indicio de irregularidade aos jornalistas que assinam os textos publicados pela Folha.
Como se vê, ainda há provas a serem produzidas visando a cabal elucidação dos fatos como, por exemplo, a obtenção de arquivos, comunicações e documentos cuja entrega espontânea foi recusada pelo investigado, entre outras evidências relativas aos crimes, havendo verdadeira necessidade pela realização da medida. Decisão do ministro Alexandre de Moraes, do STF
Diante de todo o exposto, nos termos do art. 21 do Regimento Interno do Supremo Tribunal Federal, acolho a manifestação da Procuradoria-Geral da República, defiro a representação da autoridade policial e determino a busca pessoal em face de Eduardo de Oliveira Tagliaferro, para que se proceda à apreensão do aparelho celular do investigado, bem como de outros dispositivos eletrônicos ou materiais relacionados aos fatos objeto deste inquérito.Decisão do ministro Alexandre de Moraes, do STF
Não é usual, não é comum, nunca vi apreender qualquer coisa de uma testemunha, principalmente depois de um depoimento de mais de três horas onda todas as respostas foram absolutamente completas às perguntas formuladas. Mais uma situação em que, com todo respeito, o abuso de autoridade, o excesso de poder, salta aos olhos - Eduardo Kuntz, advogado de Eduardo Tagliaferro sobre a decisão que mandou apreender o celular.
CNJ
Nesta quinta-feira, o senador Rogério Marinho (PL-RN) acionou o CNJ contra os juízes do gabinete de Moraes. Senador bolsonarista pede que sejam investigadas as suspeitas de desvio de finalidade e abuso de poder pelos juízes auxiliares Airton Vieira, do STF, e Marco Antônio Vargas, do TSE, que atuam para Moraes. O parlamentar argumenta que os magistrados teriam atuado para produzir provas de maneira irregular para embasar decisões do STF. 
Cabe ao Conselho Nacional de Justiça analisar as denúncias envolvendo magistrados e decidir se abre ou não um procedimento disciplinar contra eles. "	"Mateus Coutinho
Carla Araújo"	2024-08-22T18:43:11-03:00	2024-08-22T20:36:24-03:00	https://noticias.uol.com.br/politica/ultimas-noticias/2024/08/22/alexandre-de-moraes-manda-pf-apreender-celular-de-ex-assessor.htm	UOL
6	Manual da Voepass impede comissários de registrarem falhas nas aeronaves 	"A Anac (Agência Nacional de Aviação Civil) identificou, há um mês, problemas nos procedimentos adotados pela VoePass para o reporte de falhas de manutenção em voos operados pela empresa.
Uma inspeção do órgão regulador observou que a companhia proíbe comissários de reportarem diretamente problemas associados à manutenção das suas aeronaves. Em vez disso, as falhas devem ser relatadas aos pilotos para eventual inserção em relatório técnico.
A Anac entende que essa política desencoraja o relato de problemas técnicos nas aeronaves operadas pela companhia e solicita que a empresa revise a orientação.
""Considerando a cultura de hierarquia na aviação, provavelmente desencorajaria comissários a fazerem esses registros"", afirma o coordenador de Certificação em Aeronavegabilidade da Anac, Antonio de Quadros Andrade Júnior, em documento ao qual a coluna teve acesso.
A inspeção da Anac foi feita na Regional Linhas Aéreas, que é uma empresa da VoePass ainda em processo de certificação. O manual, contudo, é o mesmo da VoePass, como indicado no documento da agência, com diversas menções à própria VoePass em trechos do manual. O documento foi assinado em 18 de julho.
Procurada, a VoePass afirmou que ""não tem em seu manual nenhum tipo de veto à comunicação de eventuais problemas em suas aeronaves por parte da tripulação.""
Para complementar: ""Reforça também que segue as melhores práticas do setor, tendo um Departamento exclusivo para a gestão da Segurança Operacional, que também é responsável por instituir procedimentos de comunicação que asseguram canais de fácil acesso para reportes de toda e qualquer situação que alguém da companhia, inclusive a tripulação, considere um risco para a operação.""
A companhia afirmou, ainda, que ""todos os seus manuais e procedimentos são revisados e aprovados pela autoridade aeronáutica, em linha com os padrões determinados pelo fabricante das aeronaves e certificados por órgãos internacionais.""
No dia 9 de agosto, um avião da VoePass caiu em Vinhedo (SP), na rota Cascavel-Guarulhos. No acidente, 62 pessoas morreram.
Como noticiado, a mesma aeronave já havia apresentado problemas de manutenção ao longo do ano passado, com problemas associados ao sistema de degelo.
Esse trecho é operado desde junho pela empresa em um acordo com a Latam, que comercializa as passagens aéreas da rota.
Desde fevereiro de 2022, as duas empresas firmaram um acordo de codeshare, que significa oferecerem rotas compartilhadas. Um trecho é feito pela Latam e a outra perna da viagem pela VoePass em algumas rotas.
O acordo entre as duas aéreas inclui opção de compra pela Latam da Voepass. A Voepass não se manifestou se há negociações nesse sentido em curso.
No documento do acordo, constam 117 rotas nas quais a Latam consta como ""companhia comercializadora"" e a VoePass como ""companhia operadora"". Entre elas, está a rota Cascavel-Guarulhos.
Os aviões da VoePass somente começaram a fazer essa rota a partir de 2 de junho, segundo registros da Anac sobre pousos e aterrissagens no Aeroporto Internacional de Guarulhos.
Sobre o acordo, a Latam afirma que ""acordos comerciais de codeshare (código compartilhado) são frequentes na aviação brasileira e mundial. Atualmente, a LATAM mantém acordos de codeshare com empresas aéreas de todo o mundo, inclusive com a Voepass"".
Segundo a Latam, ""a empresa operadora do voo é quem responde por toda a gestão técnica e operacional, incluindo o atendimento aos passageiros nos aeroportos, o próprio voo e as suas eventuais contingências"".
O que diz o relatório da Anac:
""Sempre que as comissárias(os) tiverem reportes para a manutenção, deverão solicitar ao comandante da aeronave a inclusão dos reportes no TLB da aeronave"", indicando que não haverá um relatório técnico exclusivo para comissárias reportarem problemas técnicos da aeronave, mas que na verdade as observações delas teriam que ser inseridas pelos pilotos, no TLB. Considerando a cultura de hierarquia na aviação (entre outros fatores humanos), na prática do dia-a-dia provavelmente desencorajaria as comissárias a fazerem esses registros. Solicitamos esclarecer o procedimento e revisar conforme necessário, considerando aspectos como a cultura de hierarquia na aviação (entre outros fatores humanos), o que na prática do dia-a-dia, pode desencorajar as comissárias a fazerem tais reportes."""	Andreza Matais	2024-08-22T19:44:46-03:00		https://noticias.uol.com.br/colunas/andreza-matais/2024/08/22/manual-da-voepass-impede-comissarios-de-registrarem-falhas-nas-aeronaves.htm	UOL
